{
  "$schema": "https://json-schema.org/draft/2020-12/schema",
  "$id": "https://fulfillops.dev/contracts/events/EventEnvelope.v1.schema.json",
  "title": "EventEnvelope.v1",
  "description": "Generic envelope every FulfillOps event uses. Event-specific schemas (e.g. OrderPlaced.v1.schema.json) extend this with allOf and narrow eventType, eventVersion, and payload. See contracts/README.md for the full field-by-field convention.",
  "type": "object",
  "additionalProperties": false,
  "required": [
    "eventId",
    "eventType",
    "eventVersion",
    "occurredAt",
    "correlationId",
    "aggregateId",
    "producer",
    "payload"
  ],
  "properties": {
    "eventId": {
      "type": "string",
      "format": "uuid",
      "pattern": "^[0-9a-fA-F]{8}-[0-9a-fA-F]{4}-[0-9a-fA-F]{4}-[0-9a-fA-F]{4}-[0-9a-fA-F]{12}$",
      "description": "Unique identifier for this event instance. The outbox/inbox dedup key."
    },
    "eventType": {
      "type": "string",
      "description": "The event's name without its version, e.g. \"OrderPlaced\"."
    },
    "eventVersion": {
      "type": "integer",
      "minimum": 1,
      "description": "Payload schema version. A breaking payload change ships as a new version, never a mutation of an existing one."
    },
    "occurredAt": {
      "type": "string",
      "pattern": "^[0-9]{4}-[0-9]{2}-[0-9]{2}T[0-9]{2}:[0-9]{2}:[0-9]{2}(\\.[0-9]+)?Z$",
      "description": "UTC instant the event occurred, RFC 3339 with a literal Z offset (never a local offset)."
    },
    "correlationId": {
      "type": "string",
      "format": "uuid",
      "pattern": "^[0-9a-fA-F]{8}-[0-9a-fA-F]{4}-[0-9a-fA-F]{4}-[0-9a-fA-F]{4}-[0-9a-fA-F]{12}$",
      "description": "Identifies the end-to-end flow (e.g. one order placement) this event belongs to."
    },
    "causationId": {
      "type": ["string", "null"],
      "format": "uuid",
      "pattern": "^[0-9a-fA-F]{8}-[0-9a-fA-F]{4}-[0-9a-fA-F]{4}-[0-9a-fA-F]{4}-[0-9a-fA-F]{12}$",
      "description": "The eventId that directly caused this event, or null for the first event in a flow."
    },
    "aggregateId": {
      "type": "string",
      "format": "uuid",
      "pattern": "^[0-9a-fA-F]{8}-[0-9a-fA-F]{4}-[0-9a-fA-F]{4}-[0-9a-fA-F]{4}-[0-9a-fA-F]{12}$",
      "description": "The domain object (order, reservation, payment, fulfillment) this event is about."
    },
    "producer": {
      "type": "string",
      "enum": ["order-service", "inventory-service", "payment-service", "quality-service", "fulfillment-service"],
      "description": "The service that published this event."
    },
    "payload": {
      "type": "object",
      "description": "Event-specific fields, narrowed by each event's own schema."
    }
  }
}
